

================================================================
== Vitis HLS Report for 'cp_removal_Pipeline_cp_discard'
================================================================
* Date:           Sat Feb 28 13:09:39 2026

* Version:        2024.1 (Build 5069499 on May 21 2024)
* Project:        cp_removal
* Solution:       solution1 (Vivado IP Flow Target)
* Product family: zynquplus
* Target device:  xczu7ev-ffvc1156-2-e


================================================================
== Performance Estimates
================================================================
+ Timing: 
    * Summary: 
    +--------+---------+----------+------------+
    |  Clock |  Target | Estimated| Uncertainty|
    +--------+---------+----------+------------+
    |ap_clk  |  3.33 ns|  1.619 ns|     0.90 ns|
    +--------+---------+----------+------------+

+ Latency: 
    * Summary: 
    +---------+---------+----------+----------+-----+-----+-----------------------------------------------+
    |  Latency (cycles) |  Latency (absolute) |  Interval |                    Pipeline                   |
    |   min   |   max   |    min   |    max   | min | max |                      Type                     |
    +---------+---------+----------+----------+-----+-----+-----------------------------------------------+
    |      146|      146|  0.486 us|  0.486 us|  145|  145|  loop auto-rewind stp(delay=0 clock cycles(s))|
    +---------+---------+----------+----------+-----+-----+-----------------------------------------------+

    + Detail: 
        * Instance: 
        N/A

        * Loop: 
        +--------------+---------+---------+----------+-----------+-----------+------+----------+
        |              |  Latency (cycles) | Iteration|  Initiation Interval  | Trip |          |
        |   Loop Name  |   min   |   max   |  Latency |  achieved |   target  | Count| Pipelined|
        +--------------+---------+---------+----------+-----------+-----------+------+----------+
        |- cp_discard  |      144|      144|         1|          1|          1|   144|       yes|
        +--------------+---------+---------+----------+-----------+-----------+------+----------+

============================================================
+ Verbose Summary: Synthesis Manager
============================================================
InlineROM: 1
ExposeGlobal: 0
============================================================
+ Verbose Summary: CDFG Model
============================================================
IsTopModel: 0
ResetActiveHigh: 1
IsCombinational: 0
IsDatapathOnly: 0
HasWiredReturn: 1
HasMFsm: 2
HasVarLatency: 1
IsPipeline: 0
IsRtlPipelined: 0
IsInstanceOverlapped: 0
IsDontTouch: 0
HasImplIP: 0
IsGatedGlobalClock: 0

+ Individual pipeline summary: 
  * Pipeline-0: initiation interval (II) = 1, depth = 1


============================================================
+ Verbose Summary: Schedule
============================================================
* Number of FSM states : 1
* Pipeline : 1
  Pipeline-0 : II = 1, D = 1, States = { 1 }
* Dataflow Pipeline: 0

* FSM state transitions: 
1 --> 

* FSM state operations: 

State 1 <SV = 0> <Delay = 1.61>
ST_1 : Operation 4 [1/1] (0.00ns)   --->   "%i = alloca i32 1" [cp_removal.cpp:50]   --->   Operation 4 'alloca' 'i' <Predicate = true> <Delay = 0.00>
ST_1 : Operation 5 [1/1] (0.00ns)   --->   "%specaxissidechannel_ln0 = specaxissidechannel void @_ssdm_op_SpecAXISSideChannel, i32 %in_stream_V_data_V, i4 %in_stream_V_keep_V, i4 %in_stream_V_strb_V, i1 0, i1 %in_stream_V_last_V, i1 0, i1 0, void @empty_3"   --->   Operation 5 'specaxissidechannel' 'specaxissidechannel_ln0' <Predicate = true> <Delay = 0.00>
ST_1 : Operation 6 [1/1] (0.00ns)   --->   "%specinterface_ln0 = specinterface void @_ssdm_op_SpecInterface, i1 %in_stream_V_last_V, void @empty, i32 0, i32 0, void @empty_0, i32 0, i32 0, void @empty_1, void @empty_1, void @empty_1, i32 0, i32 0, i32 0, i32 0, void @empty_1, void @empty_1, i32 4294967295, i32 0, i32 0"   --->   Operation 6 'specinterface' 'specinterface_ln0' <Predicate = true> <Delay = 0.00>
ST_1 : Operation 7 [1/1] (0.00ns)   --->   "%specinterface_ln0 = specinterface void @_ssdm_op_SpecInterface, i4 %in_stream_V_strb_V, void @empty, i32 0, i32 0, void @empty_0, i32 0, i32 0, void @empty_1, void @empty_1, void @empty_1, i32 0, i32 0, i32 0, i32 0, void @empty_1, void @empty_1, i32 4294967295, i32 0, i32 0"   --->   Operation 7 'specinterface' 'specinterface_ln0' <Predicate = true> <Delay = 0.00>
ST_1 : Operation 8 [1/1] (0.00ns)   --->   "%specinterface_ln0 = specinterface void @_ssdm_op_SpecInterface, i4 %in_stream_V_keep_V, void @empty, i32 0, i32 0, void @empty_0, i32 0, i32 0, void @empty_1, void @empty_1, void @empty_1, i32 0, i32 0, i32 0, i32 0, void @empty_1, void @empty_1, i32 4294967295, i32 0, i32 0"   --->   Operation 8 'specinterface' 'specinterface_ln0' <Predicate = true> <Delay = 0.00>
ST_1 : Operation 9 [1/1] (0.00ns)   --->   "%specinterface_ln0 = specinterface void @_ssdm_op_SpecInterface, i32 %in_stream_V_data_V, void @empty, i32 0, i32 0, void @empty_0, i32 0, i32 0, void @empty_1, void @empty_1, void @empty_1, i32 0, i32 0, i32 0, i32 0, void @empty_1, void @empty_1, i32 4294967295, i32 0, i32 0"   --->   Operation 9 'specinterface' 'specinterface_ln0' <Predicate = true> <Delay = 0.00>
ST_1 : Operation 10 [1/1] (0.42ns)   --->   "%store_ln50 = store i8 0, i8 %i" [cp_removal.cpp:50]   --->   Operation 10 'store' 'store_ln50' <Predicate = true> <Delay = 0.42>
ST_1 : Operation 11 [1/1] (0.00ns)   --->   "%br_ln50 = br void %for.inc" [cp_removal.cpp:50]   --->   Operation 11 'br' 'br_ln50' <Predicate = true> <Delay = 0.00>
ST_1 : Operation 12 [1/1] (0.00ns)   --->   "%i_3 = load i8 %i" [cp_removal.cpp:50]   --->   Operation 12 'load' 'i_3' <Predicate = true> <Delay = 0.00>
ST_1 : Operation 13 [1/1] (0.76ns)   --->   "%icmp_ln50 = icmp_eq  i8 %i_3, i8 144" [cp_removal.cpp:50]   --->   Operation 13 'icmp' 'icmp_ln50' <Predicate = true> <Delay = 0.76> <CoreInst = "Cmp">   --->   Core 9 'Cmp' <Latency = 0> <II = 1> <Delay = 0.76> <FuncUnit> <Opcode : 'seteq' 'setne' 'setle' 'setge' 'setlt' 'setgt'> <InPorts = 2> <OutPorts = 1>
ST_1 : Operation 14 [1/1] (0.76ns)   --->   "%i_4 = add i8 %i_3, i8 1" [cp_removal.cpp:50]   --->   Operation 14 'add' 'i_4' <Predicate = true> <Delay = 0.76> <CoreInst = "Adder">   --->   Core 1 'Adder' <Latency = 0> <II = 1> <Delay = 0.76> <FuncUnit> <Opcode : 'add' 'sub'> <InPorts = 2> <OutPorts = 1>
ST_1 : Operation 15 [1/1] (0.00ns)   --->   "%br_ln50 = br i1 %icmp_ln50, void %for.inc.split, void %for.body5.preheader.exitStub" [cp_removal.cpp:50]   --->   Operation 15 'br' 'br_ln50' <Predicate = true> <Delay = 0.00>
ST_1 : Operation 16 [1/1] (0.00ns)   --->   "%specpipeline_ln52 = specpipeline void @_ssdm_op_SpecPipeline, i32 1, i32 0, i32 0, i32 0, void @empty_1" [cp_removal.cpp:52]   --->   Operation 16 'specpipeline' 'specpipeline_ln52' <Predicate = (!icmp_ln50)> <Delay = 0.00>
ST_1 : Operation 17 [1/1] (0.00ns)   --->   "%speclooptripcount_ln50 = speclooptripcount void @_ssdm_op_SpecLoopTripCount, i64 144, i64 144, i64 144" [cp_removal.cpp:50]   --->   Operation 17 'speclooptripcount' 'speclooptripcount_ln50' <Predicate = (!icmp_ln50)> <Delay = 0.00>
ST_1 : Operation 18 [1/1] (0.00ns)   --->   "%specloopname_ln50 = specloopname void @_ssdm_op_SpecLoopName, void @empty_7" [cp_removal.cpp:50]   --->   Operation 18 'specloopname' 'specloopname_ln50' <Predicate = (!icmp_ln50)> <Delay = 0.00>
ST_1 : Operation 19 [1/1] (0.07ns)   --->   "%empty = read i41 @_ssdm_op_Read.axis.volatile.i32P0A.i4P0A.i4P0A.i1P0A, i32 %in_stream_V_data_V, i4 %in_stream_V_keep_V, i4 %in_stream_V_strb_V, i1 %in_stream_V_last_V" [cp_removal.cpp:53]   --->   Operation 19 'read' 'empty' <Predicate = (!icmp_ln50)> <Delay = 0.07> <CoreInst = "regslice">   --->   Core 148 'regslice' <Latency = 0> <II = 1> <Delay = 0.65> <Adapter> <Opcode : 'read' 'write'>
ST_1 : Operation 20 [1/1] (0.42ns)   --->   "%store_ln50 = store i8 %i_4, i8 %i" [cp_removal.cpp:50]   --->   Operation 20 'store' 'store_ln50' <Predicate = (!icmp_ln50)> <Delay = 0.42>
ST_1 : Operation 21 [1/1] (0.00ns)   --->   "%br_ln50 = br void %for.inc" [cp_removal.cpp:50]   --->   Operation 21 'br' 'br_ln50' <Predicate = (!icmp_ln50)> <Delay = 0.00>
ST_1 : Operation 22 [1/1] (0.42ns)   --->   "%ret_ln0 = ret"   --->   Operation 22 'ret' 'ret_ln0' <Predicate = (icmp_ln50)> <Delay = 0.42>


============================================================
+ Verbose Summary: Timing violations
============================================================
Target clock period: 3.330ns, clock uncertainty: 0.899ns.

 <State 1>: 1.619ns
The critical path consists of the following:
	'store' operation 0 bit ('store_ln50', cp_removal.cpp:50) of constant 0 on local variable 'i', cp_removal.cpp:50 [11]  (0.427 ns)
	'load' operation 8 bit ('i', cp_removal.cpp:50) on local variable 'i', cp_removal.cpp:50 [14]  (0.000 ns)
	'icmp' operation 1 bit ('icmp_ln50', cp_removal.cpp:50) [15]  (0.765 ns)
	'store' operation 0 bit ('store_ln50', cp_removal.cpp:50) of variable 'i', cp_removal.cpp:50 on local variable 'i', cp_removal.cpp:50 [23]  (0.427 ns)


============================================================
+ Verbose Summary: Binding
============================================================
N/A
* FSMD analyzer results:
  - Output states:
 - Input state : 
  - Chain level:
	State 1


============================================================
+ Verbose Summary: Datapath Resource usage 
============================================================
N/A
